title,album,year,lyrics,image
Rap God,The Marshall Mathers LP2 (Deluxe),2013-10-15,look i was gonna go easy on you not to hurt your feelings but i am only going to get this one chance somethings wrong i can feel it just a feeling i have got like somethings about to happen but i do not know what if that means what i think it means we are in trouble big trouble and if he is as bananas as you say i am not taking any chances you are just what the doc ordered i am beginning to feel like a rap god rap god all my people from the front to the back nod back nod now who thinks their arms are long enough to slap box slap box they said i rap like a robot so call me rapbot but for me to rap like a computer it must be in my genes i got a laptop in my back pocket my pen will go off when i halfcock it got a fat knot from that rap profit made a living and a killing off it ever since bill clinton was still in office with monica lewinsky feeling on his nutsack i am an mc still as honest but as rude and as indecent as all hell syllables skillaholic this flippity dippityhippity hiphop you do not really wanna get into a pissing match with this rappity brat packing a mac in the back of the ac backpack rap crap yapyap yacketyyack and at the exact same time i attempt these lyrical acrobat stunts while i am practicing that i will still be able to break a motherfucking table over the back of a couple of faggots and crack it in half only realized it was ironic i was signed to aftermath after the fact how could i not blow all i do is drop fbombs feel my wrath of attack rappers are having a rough time period heres a maxi pad it is actually disastrously bad for the wack while i am masterfully constructing this masterpiece as because i am beginning to feel like a rap god rap god all my people from the front to the back nod back nod now who thinks their arms are long enough to slap box slap box let me show you maintaining this shit ai not that hard that hard everybody wants the key and the secret to rap immortality like have got well to be truthful the blueprints simply rage and youthful exuberance everybody loves to root for a nuisance hit the earth like an asteroid did nothing but shoot for the moon since mcs get taken to school with this music because i use it as a vehicle to bus the rhyme now i lead a new school full of students me i am a product of rakim lakim shabazz 2pac nwa cube hey doc ren yella eazy thank you they got slim inspired enough to one day grow up blow up and be in a position to meet rundmc induct them into the motherfucking rock and roll hall of fame even though i will walk in the church and burst in a ball of flames only hall of fame i will be inducted in is the alcohol of fame on the wall of shame you fags think it is all a game until i walk a flock of flames off a plank and tell me what in the fuck are you thinking little gaylooking boy so gay i can barely say it with a straight face looking boy you are witnessing a massoccur like you are watching a church gathering take place looking boy oy vey that boys gaythat is all they say looking boy you get a thumbs up pat on the back and a way to go from your label every day looking boy hey looking boy what you say looking boy i get a hell yeah from dre looking boy i ama work for everything i have never asked nobody for shit get outta my face looking boy basically boy you are never gonna be capable of keeping up with the same pace looking boy because i am beginning to feel like a rap god rap god all my people from the front to the back nod back nod the way i am racing around the track call me nascar nascar dale earnhardt of the trailer park the white trash god kneel before general zod this planets kryptonno asgard asgard so you will be thor i will be odin you rodent i am omnipotent let off then i am reloading immediately with these bombs i am toting and i should not be woken i am the walking dead but i am just a talking head a zombie floating but i got your mom deepthroating i am out my ramen noodle we have nothing in common poodle i am a doberman pinch yourself in the arm and pay homage pupil it is me my honestys brutal but it is honestly futile if i do not utilize what i do though for good at least once in a while so i wanna make sure somewhere in this chicken scratch i scribble and doodle enough rhymes to maybe try to help get some people through tough times but i gotta keep a few punchlines just in case because even you unsigned rappers are hungry looking at me like it is lunchtime i know there was a time where once i was king of the underground but i still rap like i am on my pharoahe monch grind so i crunch rhymes but sometimes when you combine appeal with the skin color of mine you get too big and here they come trying to censor you like that one line i said on i am back from the mathers lp 1 when i tried to say i will take seven kids from columbine put em all in a line add an ak47 a revolver and a 9 see if i get away with it now that i ai not as big as i was but i am morphing into an immortal coming through the portal you are stuck in a time warp from 2004 though and i do not know what the fuck that you rhyme for you are pointless as rapunzel with fucking cornrows you write normal fuck being normal and i just bought a new raygun from the future just to come and shoot ya like when fabolous made ray j mad because fab said he looked like a fag at mayweathers pad singing to a man while he played piano man oh man that was a twentyfour seven special on the cable channel so ray j went straight to the radio station the very next day hey fab i ama kill you lyrics coming at you at supersonic speed uh summalumma doomalumma you assuming i am a human what i gotta do to get it through to you i am superhuman innovative and i am made of rubber so that anything you say is ricocheting off of me and it will glue to you and i am devastating more than ever demonstrating how to give a motherfucking audience a feeling like it is levitating never fading and i know the haters are forever waiting for the day that they can say i fell off they will be celebrating because i know the way to get em motivated i make elevating music you make elevator music oh he is too mainstream well that is what they do when they get jealous they confuse it it is not hiphop it is popbecause i found a hella way to fuse it with rock shock rap with doc throw on lose yourself and make em lose it i do not know how to make songs like that i do not know what words to use let me know when it occurs to you while i am ripping any one of these verses that versus you it is curtains i am inadvertently hurting you how many verses i gotta murder to prove that if you were half as nice your songs you could sacrifice virgins too ugh school flunky pill junkie but look at the accolades these skills brung me full of myself but still hungry i bully myself because i make me do what i put my mind to and i am a million leagues above you ill when i speak in tongues but it is still tongueincheek fuck you i am drunk so satan take the fucking wheel i ama sleep in the front seat bumping heavy d and the boyz still chunky but funky but in my head there is something i can feel tugging and struggling angels fight with devils and heres what they want from me they are asking me to eliminate some of the women hate but if you take into consideration the bitter hatred i have then you may be a little patient and more sympathetic to the situation and understand the discrimination but fuck it lifes handing you lemons make lemonade then but if i cannot batter the women how the fuck am i supposed to bake them a cake then do not mistake him for satan it is a fatal mistake if you think i need to be overseas and take a vacation to trip a broad and make her fall on her face and do not be a retardbe a king think not why be a king when you can be a god,https://images.genius.com/058e2359838c93395c36119b48a2eff6.1000x1000x1.png
Killshot,,2018-09-14,you sound like a bitch bitch shut the fuck up when your fans become your haters you done fucking beards weird alright you yelling at the mic fucking weird beard we doing this once you yelling at the mic your beards weird why you yell at the mic rihanna just hit me on a text last night i left hickeys on her neck wait you just dissed me i am perplexed insult me in a line compliment me on the next damn i am really sorry you want me to have a heart attack was watching 8 mile on my nordictrack realized i forgot to call you back heres that autograph for your daughter i wrote it on a starter cap stan stan son listen man dad is not mad but how you gonna name yourself after a damn gun and have a manbun the giants woke eyes open undeniable supplying smoke got the fire stoked say you got me in a scope but you grazed me i say one call to interscope and you are swayze your reply got the crowd yelling woo so before you die lets see who can outpetty who with your corny lines ow kelly ooh but i am 45 and i am still outselling you by 29 i had three albums that had blew now lets talk about something i do not really do go in someones daughters mouth stealing food but you are a fucking mole hill now i ama make a mountain out of you woo ho chill acting like you put the chrome barrel to my bone marrow gunner bitch you ai not a bow and arrow say you will run up on me like a phone bill spraying lead playing dead that is the only time you hold still are you eating cereal or oatmeal what the fucks in the bowl milk wheaties or cheerios because i am taking a shit in em kelly i need reading material dictionary yo slim your last four albums sucked go back to recovery oh shoot that was three albums ago what do you know oops know your facts before you come at me lil goof luxury oh you broke bitch yeah i had enough money in 02 to burn it in front of you ho younger me no you the wack me it is funny but so true i would rather be 80yearold me than 20yearold you until i am hitting old age still can fill a whole page with a 10yearolds rage got more fans than you in your own city lil kiddy go play feel like i am babysitting lil tay got the diddy okay so you spent your whole day shooting a video just to fucking dig your own grave got you at your own wake i am the billy goat you ai not never made a list next to no biggie no jay next to taylor swift and that iggy ho you about to really blow kelly they will be putting your name next to ja next to benzinodie motherfucker like the last motherfucker saying hailie in vain alien brain you satanist my biggest flops are your greatest hits the games mine again and ai not nothing changed but the locks so before i slay this bitch i mwah give jade a kiss gotta wake up labor day to this being richshamed by some prick using my name for clickbait in a state of bliss because i said his goddamn name now i gotta cock back aim yeah bitch pop champagne to this it is your moment this is it as big as you are gonna get so enjoy it had to give you a career to destroy it lethal injection go to sleep six feet deep i will give you a b for the effort but if i was threefooteleven you would look up to me and for the record you would suck a dick to fucking be me for a second lick a ballsack to get on my channel give your life to be as solidified this mothafucking shit is like rambo when he is out of bullets so what good is a fucking machine gun when it is outta ammo had enough of this tattedup mumble rapper how the fuck can him and i battle he will have to fuck kim in my flannel i will give him my sandals because he knows long as i am shady he is gong have to live in my shadow exhausting letting off on my offspring lick a gun barrel bitch get off me you dance around it like a sombrero we can all see you are fucking salty because young geralds ballsdeep inside of halsey your red sweater your black leather you dress better i rap better that a death threat or a love letter little white toothpick thinks it is over a pic i just do not like you prick thanks for dissing me now i had an excuse on the mic to write not alike but really i do not care who is in the right but you are losing the fight you picked who else want it kellsattempt fails buddenls fucking nails in these coffins as soft as cottonelle killshot i will not fail i am with the doc still but this idiots boss pops pills and tells him he is got skills but kells the day you put out a hit is the day diddy admits that he put the hit out that got pac killed ah i am sick of you being wack and still using that mothafucking autotune so lets talk about it i am sick of your mumble rap mouth need to get the cock up out it before we can even talk about it i am sick of your blonde hair and earrings just because you look in the mirror and think that you are marshall mathers do not mean you are and you are not about it so just leave my dick in your mouth and keep my daughter out it you fuckingoh and i am just playing diddy you know i love you,https://images.genius.com/b1da996dcb2acb56506b8e02612e8561.1000x1000x1.png
Godzilla,Music to Be Murdered By,2020-01-17,ugh you are a monster i can swallow a bottle of alcohol and i will feel like godzilla betterhitthe deck likethe card dealer my whole squads inhere walking around the party a cross between a zombie apocalypse and bbobby the brain heenan which is probably the same reason i wrestle with mania shadys in this bitch i am posse would up consider it to cross me a costly mistake if they sleeping on me the hoes better get insomnia adhd hydroxycut pass the courvoisier in aa with an ak melee finna set it like a playdate better vacate retreat like a vacay mayday this beat is craycray ray j hahaha laughing all the way to the bank i spray flames they cannot tame or placate the monster you get in my way i ama feed you to the monster i am normal during the day but at night turn to a monster when the moon shines like ice road truckers i look like a villain outta those blockbusters godzilla fire spitter monster blood on the dance floor and louis v carpet fire godzilla fire monster blood on the dance floor and louis v carpet i am just a product of slick rick and onyx told em lick the balls had em just appalled did so many things that pissed em off it is impossible to list em all and in the midst of all this i am in a mental hospital with a crystal ball tryna see will i still be like this tomorrow risperdal voices whisper my fist is balled back up against the wall pencil drawn this is just the song to go ballistic on you just pulled a pistol on a guy with a missile launcher i am just a loch ness the mythological quick to tell a bitch screw off like a fifth of vodka when you twist the top of the bottle i am a monster you get in my way i ama feed you to the monster i am normal during the day but at night turn to a monster when the moon shines like ice road truckers i look like a villain outta those blockbusters godzilla fire spitter monster blood on the dance floor and louis v carpet fire godzilla fire monster blood on the dance floor and louis v carpet if you never gave a damn  raise your hand because i am about to set trip vacation plans i am on point like my index is so all you will ever get is the motherfucking finger  prostate exam how can i have all these fans and perspire like a liars pants i am on fire and i got no plans to retire and i am still the man you admire these chicks are spazzing out i only get more handsome and flyer i got em passing out like what you do when you hand someone flyers and what goes around comes around just like the blades on the chainsaw because i caught the flack but my dollars stacked right off the bat like a baseball like kid ink bitch i got them racks with so much ease that they call me diddy because i make bands and i call getting cheese a cakewalk bitch i am a player i am too motherfucking stingy for cher will not even lend you an ear ai not even pretending to care but i tell a bitch i will marry her if she will bury her face in my genital area the original richard ramirez cristhian rivera because my lyrics never sit well so they wanna give me the chair like a paraplegic and it is scary call it hari kari because ery tom and dick and harry carry a merriam motherfucking dictionary on em swearing up and down they can spit this shit is hilarious it is time to put these bitches in the obituary column we would not see eye to eye with a staring problem get the shaft like a steering column trigger happy pack heat but it is black ink evil half of the bad meets evil that means take a back seat take it back to fat beats with a maxi single look at my rap sheet what attracts these people is my gangsta bitch like apache with a catchy jingle i stack chips you barely got a halfeaten cheeto fill em with the venom and eliminate em other words i minute maid em i do not wanna hurt em but i did i am in a fit of rage i am murdering again nobody will evade i am fitting to kill em and dumping their fucking bodies in the lake obliterating everything incinerate a renegade i am here to make anybody who want it with the pen afraid but do not nobody want it but they are gonna get it anyway because i am beginning to feel like i am mentally ill i am attila kill or be killed i am a killer bee the vanilla gorilla you are bringing the killer within me outta me you do not wanna be the enemy of the demon who entered me or be on the receiving end of me what stupidity it would be every bit of mes the epitome of a spitter when i am in the vicinity motherfucker you better duck or you finna be dead the minute you run into me a hundred percent of you is a fifth of a percent of me i am about to fucking finish you bitch i am unfadable you wanna battle i am available i am blown up like an inflatable i am undebatable i am unavoidable i am unevadable i am on the toilet bowl i got a trailer full of money and i am paid in full i am not afraid to pull a man stop look what i am planning haha,https://images.genius.com/e7ec9f0d94b506dadfc6a34a801cd56d.600x600x1.png
Lose Yourself,The Singles,2002-10-28,look if you had one shot or one opportunity to seize everything you ever wanted in one moment would you capture it or just let it slip yo his palms are sweaty knees weak arms are heavy there is vomit on his sweater already moms spaghetti he is nervous but on the surface he looks calm and ready to drop bombs but he keeps on forgetting what he wrote down the whole crowd goes so loud he opens his mouth but the words will not come out he is choking how everybodys joking now the clocks run out times up overblaow snap back to reality ope there goes gravity ope there goes rabbit he choked he is so mad but he will not give up that easy no he will not have it he knows his whole backs to these ropes it do not matter he is dope he knows that but he is broke he is so stagnant he knows when he goes back to this mobile home that is when it is back to the lab again yo this old rap shit he better go capture this moment and hope it do not pass him and you better lose yourself in the music the moment you own it you better never let it go you only get one shot do not miss your chance to blow this opportunity comes once in a lifetime yo you better lose yourself in the music the moment you own it you better never let it go you only get one shot do not miss your chance to blow this opportunity comes once in a lifetime yo you better his souls escaping through this hole that is gaping this world is mine for the taking make me king as we move toward a new world order a normal life is boring but superstardoms close to postmortem it only grows harder homie grows hotter he blows it is all over these hoes is all on him coasttocoast shows he is known as the globetrotter lonely roads god only knows he is grown farther from home he is no father he goes home and barely knows his own daughter but hold your nose because here goes the cold water these hoes do not want him no more he is cold product they moved on to the next schmoe who flows he nosedove and sold nada and so the soap opera is told it unfolds i suppose it is old partner but the beat goes on dadadom dadom dahdah dahdah you better lose yourself in the music the moment you own it you better never let it go you only get one shot do not miss your chance to blow this opportunity comes once in a lifetime yo you better lose yourself in the music the moment you own it you better never let it go you only get one shot do not miss your chance to blow this opportunity comes once in a lifetime yo you better no more games i ama change what you call rage tear this motherfucking roof off like two dogs caged i was playing in the beginning the mood all changed i have been chewed up and spit out and booed off stage but i kept rhyming and stepped right in the next cypher best believe somebodys paying the pied piper all the pain inside amplified by the fact that i cannot get by with my nineto five and i cannot provide the right type of life for my family because man these goddamn food stamps do not buy diapers and there is no movie there is no mekhi phifer this is my life and these times are so hard and it is getting even harder tryna feed and water my seed plus teetertotter caught up between being a father and a prima donna baby mama drama screaming on her too much for me to wanna stay in one spot another day of monotonys gotten me to the point i am like a snail i have got to formulate a plot or end up in jail or shot success is my only motherfucking optionfailures not mom i love you but this trailers got to go i cannot grow old in salems lot so here i go it is my shot feet fail me not this may be the only opportunity that i got you better lose yourself in the music the moment you own it you better never let it go you only get one shot do not miss your chance to blow this opportunity comes once in a lifetime yo you better lose yourself in the music the moment you own it you better never let it go you only get one shot do not miss your chance to blow this opportunity comes once in a lifetime yo you better you can do anything you set your mind to man,https://images.genius.com/ce61c1b2664c5952984e30f9b59f1346.1000x1000x1.png
The Monster,The Marshall Mathers LP2 (Deluxe),2013-10-29,i am friends with the monster that is under my bed get along with the voices inside of my head you are trying to save me stop holding your breath and you think i am crazy yeah you think i am crazy i wanted the fame but not the cover of newsweek oh well guess beggars cannot be choosey wanted to receive attention for my music wanted to be left alone in public excuse me for wanting my cake and eat it too and wanting it both ways fame made me a balloon because my ego inflated when i blew see but it was confusing because all i wanted to dos be the bruce lee of loose leaf abused ink used it as a tool when i blew steam whoo hit the lottery oohwee but with what i gave up to get it was bittersweet it was like winning a used mink ironic because i think i am getting so huge i need a shrink i am beginning to lose sleep one sheep two sheep going coocoo and kooky as kool keith but i am actually weirder than you think because i am i am friends with the monster that is under my bed get along with the voices inside of my head you are trying to save me stop holding your breath and you think i am crazy yeah you think i am crazy well that is nothing well that is nothing now i ai not much of a poet but i know somebody once told me to seize the moment and do not squander it because you never know when it all could be over tomorrow so i keep conjuring sometimes i wonder where these thoughts spawn from yeah ponderin will do you wonders no wonder you are losing your mind the way it wanders yodelodelayheehoo i think it went wandering off down yonder and stumbled onto jeff vanvonderen because i need an interventionist to intervene between me and this monster and save me from myself and all this conflict because the very thing that i loves killing me and i cannot conquer it my ocds conking me in the head keep knocking nobodys home i am sleepwalking i am just relaying what the voice in my heads saying do not shoot the messenger i am just friends with the i am friends with the monster that is under my bed get along with the voices inside of my head you are trying to save me stop holding your breath and you think i am crazy yeah you think i am crazy well that is nothing well that is nothing call me crazy but i have this vision one day that i will walk amongst you a regular civilian but until then drums get killed and i am coming straight at mcs blood gets spilled and i will take you back to the days that i would get on a dre track give every kid who got played that pumpedup feeling and shit to say back to the kids who played him i ai not here to save the fucking children but if one kid out of a hundred million who are going through a struggle feels it and relates that is great it is payback russell wilson falling way back in the draft turn nothing into something still can make that straw into gold chump i will spinrumpelstiltskin in a haystack maybe i need a straightjacket face facts i am nuts for real but i am okay with that it is nothing i am still friends with the i am friends with the monster that is under my bed get along with the voices inside of my head you are trying to save me stop holding your breath and you think i am crazy yeah you think i am crazy i am friends with the monster that is under my bed get along with the voices inside of my head you are trying to save me stop holding your breath and you think i am crazy yeah you think i am crazy well that is nothing well that is nothing,https://images.genius.com/f8e3befb0dfae2eaa6833b4374f1b372.1000x1000x1.png
