title,album,year,lyrics,image
Survival,The Marshall Mathers LP2 (Deluxe),2013-10-08,this is survival of the fittest this is do or die this is the winner takes it all so take it all aall aall aall was not ready to be no millionaire i was illprepared i was prepared to be ill though the skill was there from the beginning it was not about the ends it was about busting raps and standing for something fuck an acronym cut the fucking act like you are happy i am fucking back again with another anthem why stop when it does not have to end it ai not over until i say it is over enough when i say enough throw me to them wolves and close the gate up i am afraid of what will happen to them wolves when the thought of being thrown into an alligator pit i salivate at it wait is up hands up like it is 12 noon nah homie hold them bitches straighter up wave em until you dislocate a rotator cuff came up rough came to ruffle feathers nah egos i ai not deflate enough last chance to make this whole stadium erupt because this is survival of the fittest this is do or die this is the winner takes it all so take it all aall aall aall i can see the finish line with each line that i finish i am so close to my goals i can almost pole vault over the goal post and if i do not got enough in the tank maybe i can just siphon enough to fill up this last can man will i survive in this climate or what they said i was washedup and got a bloodbath i am not a rapper i am an adapter i can adjust plus i can just walk up to a mic and just bust so floors open if you would like to discuss top 5 in this muhfucka and if i do not make the cut what like i give a fuck i ama light this bitch up like i am driving a truck through the side of a pump 0 to 60 hop in and gun it like gunit without the hyphen i am hyping em up and if there should ever come a time where my lifes in a rut and i look like i might just give up eh might have mistook me for bowing out i ai not taking a bow i am stabbing myself with a fucking knife in the gut while i am wiping my butt because i just shitted on the mic and i like getting cut i get excited at the sight of my blood you are in a fight with a nut because i ama fight until i die or win biting the dust it will just make me angrier wait let me remind you of what got me this far picture me quitting now draw a circle around it and put a line through it slut it is survival of what this is survival of the fittest this is do or die this is the winner takes it all so take it all aall aall aall so take it all aall aall aall so get your ideas stack your ammo but do not come unless you come to battle now mount up jump in the saddle this is itit is what you eat sleep piss and shit live breathe your whole existence just consists of this refuse to quit fuse is lit cannot defuse the wick if i do not do this music shit i will lose my shit ai not got shit to lose it is the moment of truth it is all i know how to do as soon as i get thrown in a booth i spit but my respect is overdue i am showing you the flow no one do because i do not own no diploma for school i quit so there is nothing for me to fall back on i know no other trade so you better trade your fucking mics in for some toolboxes because you will never take my pride from me it will have to be pried from me so pull out your pliers and your screwdrivers but i want you to doubt me i do not want you to buhlieve because this is something that i must use to succeed and if you do not like me then fuck you selfesteem must be fucking shooting through the roof because trust me my skin is too thick and bulletproof to touch me i can see why the fuck i disgust you i must be allergic to failure because everytime i come close to it i just sneeze but i just go achoo then achieve this is survival of the fittest this is do or die this is the winner takes it all so take it all aall aall aall so take it all aall aall aall,https://images.genius.com/0c496468de3457b84accb4de08b32dfd.1000x1000x1.png
No Love,Recovery,2010-06-18,intro haddaway eminem   lil wayne  love love love love love  mumbling chorus  do not hurt me do not hurt me no more young money yeah no more love verse 1 lil wayne  haddaway  throw dirt on me and grow a wildflower but it is fuck the world get a child out her yeah my life a bitch but you know nothing about her been to hell and back i can show you vouchers  no love  i am rolling sweets i am smoking sour married to the game but she broke her vows that is why my bars are full of broken bottles and my nightstands are full of open bibles uh i think about more than i forget but i do not go around fire expecting not to sweat and these niggas know i lay em down make your bed bitches try to kick me while i am down i will break your leg money outweighing problems on a triple beam i am sticking to the script you niggas skipping scenes uh be good or be good at it fucking right i got my gun semicartermatic yeah put a dick in they mouth so i guess it is fuck what they say i am high as a bitch up up and away man i will come down in a couple of days okay you want me up in the cage then i will come out in beast mode i got this world stuck in the safe combination is the g code it is weezy motherfucker blood gang and i am in bleed mode all about my dough but i do not even check the peephole so you can keep knocking but will not knock me down no love lost no love found chorus eminem lil wayne  both    it is a little too late to say that you are sorry now  yeah  you kicked me when i was down but what you say just do not that is right it do not and i do not need you do not wanna see you ha bitch you get no you showed me nothing but hate  haha  you ran me into the ground but what comes around goes around  yeah  and i do not need you that is right you do not and i do not need you do not wanna see you ha bitch you get no love no no no ha bitch you get no love no no and i do not need you get em  verse 2 eminem  lil wayne   both  i am alive again more alive than i have been in my whole entire life i can  yeah  see these peoples ears perk up as i begin to spaz with the pen uh i am a little bit sicker than most shit is finna get thick again they say the competition is stiff but i get a hard dick from this shit and i stick it in i ai not never giving in again  yeah  caution to the wind complete freedom look at these rappers how i treat em so why the fuck would i join em when i beat em  yeah  they call me a freak because i like to spit on these pussies fore i eat em  haha  man get these whack cocksuckers off stage where the fuck is kanye when you need him  oh  snatch the mic from em bitch i ama let you finish in a minute yeah that rap was tight but i am  yeah  about to spit the greatest verse of all time so you might want to go back to the lab tonight and um  yeah  scribble out them rhymes you were gonna spit and start over from scratch and write new ones but i am afraid that it ai not gonna make no difference when i rip this stage and tear it in half tonight it is an adrenaline rush to feel the bass thump from the place all the way to the parking lot fellow set fire to the mic and ignite the crowd  yeah  you can see the sparks from hot metal  yeah  coldhearted from the day i bogarted the game my soul started to rot fellow  yeah  when i am not even in my harshest you can still get roasted cause marsh is not mellow until i am toppling from the top i am not gonna stop i am standing on my monopoly board  uh  that means i am on top of my game and it do not stop until my hip do not hop anymore  shit  when you are so good that you cannot say it cause it ai not even cool for you to sound cocky anymore  shit  people just get sick cause you spit these fools cannot drool or dribble a drop anymore  ow  and you can never break my stride  nope  you will never slow the momentum at any moment i am about to blow you will never take my pride killing the flow slow venom and the opponent is getting no mercy mark my words ai not letting up relentless i smell blood i do not give a fuck keep giving them hell where was you when i fell and needed help up you get no love chorus eminem lil wayne  both    it is a little too late to say that you are sorry now  uh  you kicked me when i was down but what you say just do not yeah that is right it do not and i do not need you do not wanna see you ha bitch you get no you showed me nothing but hate  yeah  you ran me into the ground but what comes around goes around and i do not need you that is right you do not and i do not need you do not wanna see you ha bitch you get no love no no no ha bitch you get no love no no and i do not need you ha bitch you get no love,https://images.genius.com/0f0ae47f814074e0aa3e5523bcef8e9b.1000x1000x1.png
Beautiful,Relapse,2009-05-15,lately i have been hard to reach i have been too long on my own everybody has a private world where they can be alone are you calling me are you trying to get through are you reaching out for me then i am reaching out for you i am just so fucking depressed i just cannot seem to get out this slump if i could just get over this hump but i need something to pull me out this dump i took my bruises took my lumps fell down and i got right back up but i need that spark to get psyched back up in order for me to pick the mic back up i do not know how or why or when i ended up in this position i am in i am starting to feel distant again so i decided just to pick this pen up and try to make an attempt to vent but i just cannot admit or come to grips with the fact that i may be done with rap i need a new outlet and i know some shit is so hard to swallow but i just cannot sit back and wallow in my own sorrow but i know one fact i will be one tough act to follow one tough act to follow i will be one tough act to follow here today gone tomorrow but you would have to walk a thousand miles in my shoes just to see what it is like to be me i will be you lets trade shoes just to see what it would be like to feel your pain you feel mine go inside each others minds just to see what we find look at shit through each others eyes but do not let em say you ai not beautiful they can all get fucked just stay true to you do not let em say you ai not beautiful they can all get fucked just stay true to you i think i am starting to lose my sense of humor everythings so tense and gloom i almost feel like i gotta check the temperature of the room just as soon as i walk in it is like all eyes on me so i try to avoid any eye contact cause if i do that then it opens a door for conversation like i want that i am not looking for extra attention i just wanna be just like you blend in with the rest of the room maybe just point me to the closest restroom i do not need no fucking man servant tryna follow me around and wipe my ass laugh at every single joke i crack and half of em ai not even funny like ha marshall you are so funny man you should be a comedian goddamn unfortunately i am i just hide behind the tears of a clown so why do not you all sit down listen to the tale i am about to tell hell we do not gotta trade our shoes and you ai not gotta walk no thousand miles in my shoes just to see what it is like to be me i will be you lets trade shoes just to see what it would be like to feel your pain you feel mine go inside each others minds just to see what we find look at shit through each others eyes but do not let em say you ai not beautiful they can all get fucked just stay true to you do not let em say you ai not beautiful they can all get fucked just stay true to you nobody asked for life to deal us with these bullshit hands we are dealt we gotta take these cards ourselves and flip em do not expect no help now i could have either just sat on my ass and pissed and moaned or take this situation in which i am placed in and get up and get my own i was never the type of kid to wait by the door and pack his bags and sat on the porch and hoped and prayed for a dad to show up who never did i just wanted to fit in in every single place every school i went i dreamed of being that cool kid even if it meant acting stupid aunt edna always told me keep making that face it will get stuck like that meanwhile i am just standing there holding my tongue trying to talk like this until i stuck my tongue on that frozen stop sign pole at 8 years old i learned my lesson then cause i was not trying to impress my friends no more but i already told you my whole life story not just based on my description cause where you see it from where you are sitting it is probably 110 different i guess we would have to walk a mile in each others shoes at least what size you wear i wear 10s lets see if you can fit your feet in my shoes just to see what it is like to be me i will be you lets trade shoes just to see what it would be like to feel your pain you feel mine go inside each others minds just to see what we find look at shit through each others eyes but do not let em say you ai not beautiful they can all get fucked just stay true to you do not let em say you ai not beautiful they can all get fucked just stay true to you lately i have been hard to reach i have been too long on my own everybody has a private world where they can be alone are you calling me are you trying to get through are you reaching out for me then i am reaching out for you yeah to my babies stay strong daddy will be home soon and to the rest of the world god gave you shoes to fit you so put em on and wear em be yourself man be proud of who you are and even if it sounds corny never let no one tell you you ai not beautiful,https://images.genius.com/d14fd7b44108ca26b96497381e016ca8.1000x1000x1.png
Greatest,Kamikaze,2018-08-31,motherfuckers talking crazy sayin i should quit i fucking tell em make me eat a fuckin dick i am feeling like the greatest on the beat who ever did it mike will the one who made it it is shady on the lyrics i am somewhat outlandish they say you say we are cut from the same cloth but i guess you fabricate eh you better bring more men than the latter day saints manic states stephen paddock with automatic stay spraying at anything that may stand in they way as i stand at the bay window with a hand grenade and a trey eight at the mandalay bay common sense i am a dollar short and a day late james holmes at the saturday batman matinee must have missed my cat scan that day i just threw a tampax at dre trashcan tascam and ashtray im turnin back to a madman cannot take anymore but i try to get away from the anger and rage my basal ganglias an a to the k get your ass sprayed like bidets breaking your legs eight different ways ankle to waist you chumps do not even know how to do something to give goosebumps a day when you say that somethin you wrote gave someone a lump in their throat or you had them choked up you would be yanking my chain feeling like i am headed for the padded cell the bar for me when i rap is not fair but guess that is the standard i am held to but if something like that does not tell ya you set a mark too high when platinum sales are looked at as a failure then you better take it back to the shelter and hamburger helper because damn it i am still the greatest in the world greatest in the world greatest in the world no lie i might be the best to ever do it the best to ever do it the best to ever do it i feel like the greatest woke up to honkies sounding like me never be as good never be as good packing up wifebeaters white tshirts white but i am the greatest so you sold ten million albums eh only problem is you put out ten million albums eh what was i just about to say oh yeah let me get this out the way i know there is people that are pissed about the way i mispronounced a name die antwoord fuck i still cannot say this shit but how quickly they forget who the fuck i was now ninja try to duck my slugs you let ya girl get fucked by muggs i would like to give a shout to cypress this cannot be real you dissed me and i was just trying to give you a shoutnow get the fuck out my rhyme book no more shiners already too much time took and rappers i hear you talking shit i am just too big to respond to it god forbid i forget go and jump out the window somebody better childproof it because if i lose it we can rewind to some old ja rule shit and i can remind motherfuckers how i do shit you do not got the tools i got in my toolkit i bullshit you not yall fools just forgot that i am so fucking awful with the thoughts and when i am hostile and impossible to stop so you can call it a nostril because it is not gonna ever i will never let up on the pedal might as well get the mop because i am wiping up everyone in this genre because on the mic i feel like i am the greatest in the world greatest in the world greatest in the world no lie i might be the best to ever do it the best to ever do it the best to ever do it i feel like the greatest woke up to honkies sounding like me never be as good never be as good packing up wifebeaters white tshirts white but i am the greatest oh yeah and one more thing i want to mention is you are one dimension i am a monkey wrench and i can flunk detention and i love contentions so welcome to the gun convention muscles flexing gotta strut like a front suspension and you just stuck the key up in the ignition and gave me enough gas to flood my engine psychopath michael jacks blowing up like a raft i should slap vlad with a isis flag bet you i come back twice as bad revival did not go viral denaun and royce tell me that i should take the high road fuck that i am finna hit back until i run out of gunpowder and split the scene hold the mic similar to pistol squeeze and i shoot from the hip when i grip them things and my lips are the clips got the sig lit like it is nicotine trigger me and slim gets mean bars are like bullets when i spit them schemes that is why i call the motherfuckers m16s float like a butterfly i am gonna sting like a bee you ai not harming a thing i hit a ding hard as i am gonna swing i am gonna need to put my arm in a sling but like a wedding band you gotta be diamond to even climb in the ring anomaly i am muhammad ali because i knew one day i am gonna be the greatest in the world greatest in the world greatest in the world no lie i might be the best to ever do it the best to ever do it the best to ever do it i feel like the greatest woke up to honkies sounding like me never be as good never be as good packing up wifebeaters white tshirts white but i am the greatest,https://images.genius.com/4a9ce06a1f463b0c24c98c1870d4566f.1000x1000x1.png
When Im Gone,Curtain Call: The Hits,2005-12-06,yeah it is my life in my own words i guess have you ever loved someone so much you would give an arm for not the expression no literally give an arm for when they know they are your heart and you know you are their armor and you will destroy anyone who would try to harm her but what happens when karma turns right around to bite you and everything you stand for turns on you to spite you what happens when you become the main source of her pain daddy look what i made dads gotta go catch a plane daddy where is mommy i cannot find mommy where is she i do not know go play hailie baby your daddys busy daddys writing a song this song ai not gong write itself i will give you one underdog then you gotta swing by yourself then turn right around on that song and tell her you love her and put hands on her mother who is a spitting image of her that is slim shady yeah baby slim shadys crazy shady made me but tonight shadys rockabye baby and when i am gone just carry on do not mourn rejoice every time you hear the sound of my voice just know that i am looking down on you smiling and i did not feel a thing so baby do not feel my pain just smile back and when i am gone just carry on do not mourn rejoice every time you hear the sound of my voice just know that i am looking down on you smiling and i did not feel a thing so baby do not feel my pain just smile back i keep having this dream i am pushing hailie on the swing she keeps screaming she do not want me to sing you are making mommy cry why why is mommy crying baby daddy ai not leaving no more daddy you are lying you always say that you always say this is the last time but you ai not leaving no more daddy you are mine she is piling boxes in front of the door tryna block it daddy please daddy do not leave daddy no stop it goes in her pocket pulls out a tiny necklace locket it is got a picture this will keep you safe daddy take it with ya i look up it is just me standing in the mirror these fucking walls must be talking because man i can hear em they are saying you got one more chance to do right and it is tonight now go out there and show em that you love em fore it is too late and just as i go to walk out of my bedroom door it turns to a stage they are gone and this spotlight is on and i am singing and when i am gone just carry on do not mourn rejoice every time you hear the sound of my voice just know that i am looking down on you smiling and i did not feel a thing so baby do not feel my pain just smile back and when i am gone just carry on do not mourn rejoice every time you hear the sound of my voice just know that i am looking down on you smiling and i did not feel a thing so baby do not feel my pain just smile back 60000 people all jumping out their seat the curtain closes they are throwing roses at my feet i take a bow and thank you all for coming out they are screaming so loud i take one last look at the crowd i glance down i do not believe what i am seeing daddy it is me help mommy her wrists are bleeding but baby we are in sweden how did you get to sweden i followed you daddy you told me that you were not leaving you lied to me dad and now you made mommy sad and i bought you this coin it says number one dad that is all i wanted i just wanna give you this coin i get the point fine me and mommy are going but baby wait it is too late dad you made the choice now go up there and show em that you love em more than us that is what they want they want you marshall they keep screaming your name it is no wonder you cannot go to sleep just take another pill yeah i bet you you will you rap about it yeah word kkeep it real i hear applause all this time i could not see how could it be that the curtain is closing on me i turn around find a gun on the ground cock it put it to my brain scream die shady and pop it the sky darkens my life flashes the plane that i was supposed to be on crashes and burns to ashes that is when i wake up alarm clocks ringing there is birds singing it is spring and hailies outside swinging i walk right up to kim and kiss her tell her i miss her hailie just smiles and winks at her little sister almost as if to say and when i am gone just carry on do not mourn rejoice every time you hear the sound of my voice just know that i am looking down on you smiling and i did not feel a thing so baby do not feel my pain just smile back and when i am gone just carry on do not mourn rejoice every time you hear the sound of my voice just know that i am looking down on you smiling and i did not feel a thing so baby do not feel my pain just smile back curtains closing,https://images.genius.com/0f31b12579405430b96dc8b2543c8624.1000x1000x1.png
