title,album,year,lyrics,image
Shake That,Curtain Call: The Hits,2005-12-06,whoo shady aftermath there she go shaking that ass on the flo bumping and grinding that pole the way she is grinding that pole i think i am losing control get buzzed get drunk get crunk get fucked up hit the strip club do not forget ones get your dick rubbed get fucked get sucked get wasted shitfaceted pasted plastered puke drink throw up get a new drink hit the bathroom sink throw up wipe your shoe clean got a routine going still got a few chunks on them shoestrings showing i was dehydrated until the beat vibrated i was revived as soon as this bitch gyrated them hips and licked them lips and that was it i had to get nate dogg here to sing some shit two to the one from the one to the three i like good pussy and i like good tree smoke so much weed you would not believe and i get more ass than a toilet seat three to the one from the one to the three i met a bad bitch last night in the d let me tell you how i made her leave with me conversation and hennessy i have been to the motherfucking mountaintop heard motherfuckers talk seen em drop if i ai not got a weapon i ama pick up a rock and when i bust yo ass i am gong continue to rock get your ass off the wall with your two left feet it is real easy just follow the beat do not let that fine girl pass you by look real close because strobe lights lie we about to have a party lets get it started i am looking fo a girl with a body and a sexy strut wanna get it popping baby step right up some girls they act retarded some girls are about it about it i am looking fo a girl that will do whatever the fuck i say every day she be giving it up shake that ass for me shake that ass for me come on girl shake that ass for me shake that ass for me oh girl shake that ass for me shake that ass for me come on girl shake that ass for me shake that ass for me i am a menace a dentist an oral hygienist open your mouth for about four or five minutes take a little bit of this fluoride rininse swish but do not spit it swallow it and now finish yeah me and nate do doubleg looking for a couple bitches with some double ds pop a little champagne and a couple es slip it in her bubbly we finna finna bridge 2 nate dogg  eminem  we about have a party lets get it started i am looking fo a girl i can fuck in my hummer truck apple bottom jeans and a big ol butt some girls they act retarded  man i told you  some girls are about it about it i want a bitch to sit at the crib with no panties on knows that she can but she will not say no verse 4 nate dogg with eminem  look at this lady all in front of me sexy as can be tonight i want a slut would you be mine heard you was freaky from a friend of mine now i hope you do not get mad at me but i told nate you was a freak he said he wants a slut hope you do not mind i told him how you like it from behind shake that ass for me shake that ass for me come on girl shake that ass for me shake that ass for me oh girl shake that ass for me shake that ass for me come on girl shake that ass for me shake that ass for me we about to have a party lets get it started i am looking fo a girl with a body and a sexy strut wanna get it popping baby step right up some girls they act retarded some girls are about it about it i am looking fo a girl that will do whatever the fuck i say every day she be giving it up outro nate dogg  eminem  there she go shaking that ass on the flo bumping and grinding that pole the way she is grinding that pole i think i am losing control god i ai not leaving without you bitch coming home with me and my boy and his boy and his boy and his girl haha nate dogg,https://images.genius.com/aa87349486ad7059d9f15d97c32aef96.1000x1000x1.png
Role Model,The Slim Shady LP,1999-02-23,okay i am going to attempt to drown myself you can try this at home you can be just like me mic check onetwo we recording i am cancerous so when i diss you would not wanna answer this if you responded back with a battle rap you wrote for canibus i will strangle you to death then i will choke you again and break your fucking legs until your bones poke through your skin you beef with me i ama even the score equally take you on jerry springer and beat your ass legally i get too blunted off of funny home grown because when i smoke out i hit the trees harder than sonny bono so if i said i never did drugs that would mean i lie and get fucked more than the president does hilary clinton tried to slap me and call me a pervert i ripped her fucking tonsils out and fed her sherbet my nerves hurt and lately i am on edge grabbed vanilla ice and ripped out his blond dreads every girl i ever went out with has gone les follow me and do exactly what the song says smoke weed take pills drop out of school kill people and drink jump behind the wheel like it was still legal i am dumb enough to walk in a store and steal so i am dumb enough to ask for a date with lauryn hill some people only see that i am white ignoring skill because i stand out like a green hat with a orange bill but i do not get pissed yall do not even see through the mist how the fuck can i be white i do not even exist i get a clean shave bathe go to a rave die from an overdose and dig myself up out of my grave my middle finger will not go down how do i wave and this is how i am supposed to teach kids how to behave now follow me and do exactly what you see do not you wanna grow up to be just like me i slap women and eat shrooms then od now do not you want to grow up to be just like me me and marcus allen went over to see nicole when we heard a knock at the door must have been ron gold jumped behind the door put the orgy on hold killed them both then smeared blood on the white bronco my mind will not work if my spine do not jerk i slapped garth brooks out of his rhinestone shirt i am not a player just a ill rhyme sayer that will spray a aerosol can up at the ozone layer my rap styles warped i am running out the morgue with your dead grandmothers corpse to throw it on your porch jumped in a chickenhawk cartoon with a cape on and beat up foghorn leghorn with an acorn i am about as normal as norman bates with deformative traits a premature birth that was four minutes late mother are you there i love you i never meant to hit you over the head with that shovel will someone please explain to my brain that i just severed the main vein with a chainsaw and i am in pain i take a breather and sigh either i am high or i am nuts because if you ai not tilting this room neither am i so when you see your mom with a thermometer shoved in her ass then it probably is obvious i got it on with her because when i drop this solo shit it is over with i bought cages tape opened it and dubbed over it i came to the club drunk with a fake id do not you wanna grow up to be just like me i have been with ten women who got hiv now do not you wanna grow up to be just like me i got genital warts and it burns when i pee do not you wanna grow up to be just like me i tie a rope around my penis and jump from a tree you probably wanna grow up to be just like me,https://images.genius.com/a34246ca1042010b6859b6f40efff3f6.1000x1000x1.png
BET Shady 2.0 Cypher,,2011-10-11,welcome to detroit this is the bet shady 20 cypher 2011 myself slaughterhouse and yelawolf white dawg get em put these mothafuckas in a box then i send em away put em in a gray willac and pop the trunk and throw em in the back jack ha dig em a grave put a brick inside that xerox when i print up a page moving keys i can relate because i live in the cage i throw up the a i take em to school i give em a grade an easy e for effort that is wwa white with an attitude alphabet soup is on my plate all i got is zs they sleeping on me i cannot get em awake i spoonfeed em a sound in a room full of deceivers and clowns who believe in making it rain because all they see is the clouds and i watch from the couch of the vip like a potato with a bunch of meatheads like fuck it i will just feed em a cow plenty of white boys to pick from this year but before you pick a pepper you better pick up your heater because even peter piper could pick up a mic but what it is like to pick a fight with me is like putting nikes on a cheetah better speed up or at least in my case adidas i am out this bitch drinking sprite by the twoliter holler shady records say i am from the new school i ama say check your tone and watch your mouth if they teaching how to dougie i am condoning dropping out forced to wild yall birthed me then gave me up i just perfected being hiphops foster child now check it do not blame yall for being trash fans are copping it the radios the crime scene the masses are the hostages in my youth i would throw shots the fad was dodging it i am grown i ai not watching the throne i am sabotaging it you see that fourheaded monster in the storm looms snipe em from a distance the scope got a long zoom you super mario thugs is in the wrong room gotta figure here you will not get bigger if you on shrooms if it was left to me i would revive what the game be about i would have took the wine outta amy house enough raps from you scrub cats about cocking a snub back wayne could not teach me how to love that but i got this chick from uptown she my summer bunny both parents broke but she come from money think my bread is her paper to burn so i lock her out and now she doubt david is stern she so bad i make her hit the telly from a taxi then dead her in the holiday inn learned that from max b that is why the haters envy kinda wanna send me llamas i made it right before their eyes like i was benihanas is it me or is what i am hearing just pitiful airwaves the same now the stereos typical my skings thick so the critics ignored so unafraid to die you would think i did it before the boys rodman with the trash talk magic or walt with the black ball way i bounce off the asphalt with cat paws glass jaw hood of your mask will be the blackfoot with no passport body be found in a mansion in one of my trapdoors if punks had award you status whores categore probably be that of awards between michael rapaport and kenny lattimore i know hiphops alive and well if it died you other crews would not survive the smell i spot a victim the plot will thicken when the clock is ticking i caught him slipping i gotta give him a shot i hit him with proper spitting hottest writtens and compositions so competitiongs a contradiction somebody mention they got a crooked highly fiction we probly different got gotti henchmen opposition i will body quick as bugatti engines i am on a mission to get richer the sickest lyrickicker digging a ditch for different spitters weak lyricists get disfigured sip liquor spit like a sick mixture of notorious pun and l get the big picture the poster i will roast ya my mind so deadly it is just like the beanie is close to a holster it is over control my whole coastal region like i am supposed to flow is going postal even open season heart close to freezing ruthless as eazy nigga approach i am squeezing believe me dopest westcoaster breathing so most yall hope i am vegan nope i am beefing rappers need to keep it trill give me a beat to kill too many people still eating sleeping pills people sleeping on my ether skills and yall ai not even real you about to die in this cypher before you die you should do the jada and leave a will for real i ai not a rap dude i am a dude who rap before this i was moving crack killers yall become when yall rhyme i salute and dap and if i blink they will remove your snaps you ai not cool you wack with your foolish act skinny jeans do not mean your ass shoot it means your booty claps do not play like tyler perry this the slaughterhouse of pain flow brown tight and heavy when it come to 16s i am a fiend seen in the studio near a needle with a mean lean probably writing bars to nas thiefs theme getting my yaowa on man all these olajuwons we the dream team this is an all day slaughter they fiending for us to break like beyonces water the four quarters doing all the eating and yall gotta know why i made the cut i am puerto rican ortiz keep the fire ready and trying to put me out is like trying to steal a transvestite from eddie i am doordie dope and you can make the sticker sitting on the door of that phantom your suicide note hi rihanna is nicki living with you let me know so i can buy binoculars and telescopes hi rihanna i do not need to know you better you tell me you love my music again we go together bye rihanna now back to yall fools we rock out like the outside of a guitar school thousand dollar frames i prefer to see the world through do not ask me nothing about budden i beat my girl too you ask me why do i keep her i say it is cheaper to that is why i ride around in a rolls like wiz khalifa do rappers i am your daddy i tell you straight as this you do not kill but your father will like jaden smith i tell you like i tell my spanish chick you fly but i ai not going down on no landing strip so get your wax on like daniel san or i ama have to run like de la hoya in drag when cameras come point out the greatest rapper alive i will headshot him smack his girl on the butt and buy her some red bottom bring every deceased rapper back to see his wife while i am cybersexing with jessica alba via skype im on my dboy deebo thing spiritual steelo swing like ceelo green get out the camera with your broll bling you know your flow is wack we cornered the market like a walmart in a culdesac yeah this what two million singles sold and an album that is gold look like without having to sell your soul nickel ayo lyrical miracle spiritual individual criminal subliminal in your swimming pool you are about to see peace destroyed it will never be restored when i unleash these beastly hordes on your cd stores wanna stop it you gong need a priest at least three swords a license to ill from the beastie boys three ouija boards and a squeegee and please be warned do not ask what the squeegees for or the holy water acid raps that will eat these floors eat a hole in a rhyme book you see these horns and as for me you ask when i am gone will he be mourned is puke lukewarm should casey anthony do porn can that chick fit a newborn dead baby inside a fricking shoebox with a shoehorn smothered in chloroform so she can go get her groove on can she ducttape and velcro a fetus joell yo tell joe i need his empty box from his old shelltoed adidas so i can put these babies in a fetal position they are getting elbows to the penis yeah big deal i took some little kids big wheel and spit in his fricking big kids meal quit tryna bite me and pinch you wench sit still did you just put your sixinch heel through my benz windshield is it dust we about to kick up can yelawolf fit a fifth of rum in a big cup between his stick shift in his frigging pickup and drink like a hick redneck hillbilly will until he gets hiccups flipping the script up like mike vick getting bit in his junk by a pit yup i am a sick pup i would be a horrible magician because i would fuck a trick up fix your lips up to say something fly or zip up ayy b lets see you said you were gonna do xyz until you fuck around and get dropped like an e when you add an ing do not put a k in front of that though when i mc because i am not the king of this microphone booth it is more like a phone booth superman in this bitch kryptonite will not do it gives me more power i bump the fat boys and eat rat poison take meteor showers fresh outta the mental hospital and me not flossing a middle finger while i hop in a mosh pit will be like nas doing gospel or rb you crazy me pushing up daisies that thought is impossible as if flashing across the news posdnuos was caught with a prostitute with a huge johnson boobs and a monstrous tube of lube and a bra some boots some panties and an aqua blue mazda swallowing a popsicle playing tonsil pool so kill the rumors it aint happening ima rap until i am fossil fuel,https://images.genius.com/9178189c280471861b16738ba457bcbe.500x500x1.jpg
Offended,Revival,2017-12-15,you claim if you get knocked by the cops you will give em not even a statement walk in the arraignment shoot the bailiff karate kick the plaintiff gotti with the stainless i will just call it shoddy entertainment if yall was in the party getting faded on molly had the audience sedated you would not catch a body if it fainted probably let it fall and hit the pavement but you would be the first lobbying to claim it bitch stop being a lame your hobby isnt robbery and dismembering body limbs like you was tommy lynn sells and chainsawing them in the basement hardly fits your job description  ai not nobody dipping out the back of the club like oh my god he is tripping only time you get the blade is probably with the dang lawn equipment ai not it would not take a bobby pin and wave it i need to stop being debated you are still copying xeroxing i am still copping a feel like bill cosby at will popping a pill then spill oxys in jills coffee then send her out to the hotel lobby a lil wobbly and still groggy this blond fucks reprehensible misconducts never sensible kiss my butt my set of principles is gone but until i get the president to respond my pen and pencil is a missile launcher and senator mitch mcconnells just as big of a bitch as donald shit is on bruh let me sing this shit soprano while i do it pizzicato ivanka stiffarm her while i am hitting on melania and this songs for all ya chorus eminem  kent jones  because nobody likes me everybody hates me they want me to go eat some worms  i hope you offended  and drag my name through the mud through the dirt but i ama make you eat your words  i hope you offended  you can try to hold me down but you better let me up because you are only gonna make things worse  i hope you offended  because i swear when i get up i am never gonna let up until everybody eats my turds verse 2 eminem  paul rosenberg  these drums and hard snares bring out the worst in me like justin ross harris at a nursery going ham at candy yam on nanny cam i am getting handies with the zanny xannys in the caddy armrest i am imagining objects so i am batting cobwebs from a daddy longleg in hamtramck got the panoramic camera xanax a banana hammock and a santa hat i am smelling like a damn mechanic with a chick that looks like janet jackson with a spanish accent twice her age and i am acting half it grow up nah not that i know of yall basement just got a fricking overhaul got a stripper pole installed started rolling all through those klonopins like a bowling ball like an overdose on twice the ratio of propofol and go through no withdrawal while i get fellatio and give a facial to an interracial blowup doll of rachel dolezal you are so appalled  em  sos my manager bitch i amateur fuck a pro career coast is clear but nowhere to go from here and nobodys close so do not compare they ai not nowhere near i am way over here my competition cannot see me because i do not own a mirror but marshall you are terrific so smart and gifted i am so narcissistic when i fart i sniff it do a fake dab to smell my armpits whiff it your anxietys throwing gang signs but i made strides with these rape lines i am cutting back on women hate crimes like ray rice when he facetimes bang bang bang bang time dang knives are butcher than gay wives you are gonna need sutures the same size as the blade i push into caputcha when i pull em like sleigh rides gotta stab a bitch at least eight times to make it on dateline i came to stake my claim like a canine waiting in a buffet line so kellyanne conway i am a really bad hombre come play belly dance on me i have been making wedding plans all day chorus eminem  kent jones  because nobody likes me everybody hates me they want me to go eat some worms  i hope you offended  and drag my name through the mud through the dirt but i ama make you eat your words  i hope you offended  you can try to hold me down but you better let me up because you are only gonna make things worse  i hope you offended  because i swear when i get up i am never gonna let up until everybody eats my turds eightyearold with the wordplay girl take this pole like a survey today was not my birthday but i am caked up like a dessert tray so we are in shape because you are in a slurring state im a 10 youre an eight like what i do before after and during rape you wanna get into a pissing contest and find out who is better and be made a fool out of when i pull on em r kelly with a full bladder nonhigh school grad i am not a scholar but i am so cold when i am dropping knowledge my degrees is the same as i got in college but nobodys hotter you owe me my respect i owe you nada like haloti partner blow me told you i am so dirty homie you can throw me in some holy water with some floaties on and get the soap and try to get the pope to hold me while you hose me off and nope i will not be washed you hope to god i do not explode i gotta blow this spot up though i got a lotta more i will not put the sugar coating on it though because sometimes you can feel like your energys expired raps got you drained dead tired zapped you feel like a wet pile of crap but look man like the feds bugging my phone i get why you are tapped but you gotta get your fire back catch fire get upset and fire back is what i tell myself when times get bad because sometimes i might get sad but i take the same advice i had and tell myself like i used to tell hailie when lifes a drag told her to do like her dad do not cry get mad because little baby powders belong in diaper bags i am hyper by the time you see this side of me i am right in your ass foot up it i stood up for the kid who had to put up with the bullies at his school you ai not had to have no money or go shopping just to cop a fucking attitude now my doughs amounting to a mountain that is rised too high to count it never asked to be rich all i did was wish i had a dime for every time that i was doubted but then i think about it then i am enraged because i just figured out that if i was paid for the time i spent to put the pen to the page it would be minimum wage but it is embedded in my head i never hunted for the bread and butter what i wanted was to be the one that they was scared of but i am never gonna get the credit for the sweat and blood i put up in the pen and when i am dead i wonder will they put me on a pedestal or forget i was ever this incredible i guess i better go harder than ever because i will never get another motherfucking opportunity again to offend as many people with this i can simply because i can chorus eminem  kent jones  because nobody likes me everybody hates me they want me to go eat some worms  i hope you offended  and drag my name through the mud through the dirt but i ama make you eat your words  i hope you offended  you can try to hold me down but you better let me up because you are only gonna make things worse  i hope you offended  because i swear when i get up i am never gonna let up until everybody eats my turds,https://images.genius.com/ad4d90a9693cc80e5003187b422ffdde.1000x1000x1.png
